title,description,curriculum
A Comprehensive Learning Path to Become a Data Scientist in 2024,"Where do I begin? Data science is such a huge field - where do you even start learning about Data Science?These are career-defining questions often asked by data science aspirants. There are a million resources out there to refer but the learning journey can be quite exhausting if you don’t know where to start.Don’t worry, we are here to help you take your first steps into the world of data science! Here’s the learning path for people who want to become a data scientist in 2023. We have arranged and compiled all the best resources in a structured manner so that you have a unified resource to become a successful data scientist.Moreover, we have added the most in-demand skills for the year 2023 for data scientists including storytelling, model deployment, and much more along with exercises and assignments.","Overview of the Learning Path 2024: Overview of Learning Path, Month-on-Month Plan, Your Personalized Learning Path for Data Science, AI&ML Blackbelt Plus Program (Sponsored);January 2024: Data Science Toolkit: Plan for January 2024, Understanding Machine Learning and its impact, Job of Data Scientist, Exercise, Overview of the Course, A brief introduction to Python, Introduction to Python Test, Installing Python, Theory of Operators, Exercise, Understanding Operators in Python, Operators Test, Understanding variables and data types, Variable Test, Variables and Data Types in Python, Understanding Conditional Statements, Exercise, Implementing Conditional Statements in Python, Conditional Statements test, Understanding Looping Constructs, Exercise, Implementing Looping Constructs in Python, Looping Constructs test, Understanding Functions, Implementing Functions in Python, Functions test, A brief introduction to data structure, Data Structure test, Understanding the concept of Lists, Lists test, Implementing Lists in Python, Exercise, Understanding the concept of Dictionaries, Exercise, Implementing Dictionaries in Python, Dictionaries test, Understanding the concept of Standard Libraries, Libraries test, Reading a CSV File in Python - Introduction to Pandas, Reading a CSV file in Python: Implementation, Reading a csv file in Python test, Understanding dataframes and basic operations, DataFrames and basic operations test, Reading dataframes and conduct basic operations in Python, Reading dataframes and conduct basic operations in Python Test, Indexing a Dataframe, Indexing DataFrames test, Exercise, Sorting Dataframes, Merging Dataframes, Quiz: Sorting and Merging dataframes, Apply function, Aggregating data, Quiz: Apply function and Aggregating data, Basics of Matplotlib, Data Visualization using Matplotlib, Quiz: Matplotlib, Basics of Seaborn, Data Visualization using Seaborn, Quiz: Seaborn, Regular Expressions, Understanding Regular Expressions, Quiz: Regular Expressions, Regular Expressions in  Python, Quiz: Regular Expressions in Python, Cheatsheet for Python, Instructions, Quiz, Python Coding Challenge;February 2024: Data Visualization: Exercise - Definition of Data Visualization, Why Tableau is a Powerful Tool for Professionals, Compare Tableau Against Power BI and Qlik, The Tableau Range of Products, The 5 Tableau Products you should Know, Installing Tableau Desktop on your System, Installing Tableau Public on your System, Difference Between Tableau Server and Tableau Online, Navigating the Tableau Interface (Part 1), Navigating the Tableau Interface (Part 2), Connecting to Data Sources in Tableau, Understanding the Problem Statement, Download the Superstore Dataset, Loading the Dataset and Getting Familiar with the Variables, Build your First Visualization in Tableau!, Hands-On with Labels and Formatting, Playing Around with Colors, Using Filters to Build a Pivot Structure in Tableau, Exporting your Tableau Worksheet, The Different Chart Types in Tableau, Line Charts - Working with Time Series Data, Building Line Charts in Tableau, Exercise - Sales of Each Category Month-by-Month, Generating Map Visualizations for Geospatial Analysis, Map Visualizations in Tableau, Exercise - Sales by City Analysis, Bar Charts, Histograms, Scatter Plots, Bubble Charts, Pie Charts, Dual Axis Charts in Tableau, Date Dual Axis Charts in Tableau, What are Calculated Fields?, Feature Engineering in Tableau - Average Shipping Time, Exercise - Number of Orders per State, Calculating the Average Order Value, Average Order Value for Product Sub-Categories, What are Parameters in Tableau?, Using Parameters to find Top N Customers, Using Parameters to Analyze Superstore's Variable Values, Joins and their Different Types in Tableau, Performing Data Joining in Tableau, What is Blending? How is it Different from Joins?, Blending Data in Tableau, Download the Coffee Chain Dataset, Introduction to Dashboards and their Use Cases, Reading Material - Dashboards in Tableau, Designing your First Dashboard in Tableau, Using Parameters to Create Dynamic Dashboards, How to Upload your Work to the Tableau Public Gallery, Designing the Blueprint for a Multi-Dashboard View to Analyze Sales, Building Multiple Interlinked Dashboards in Tableau for our Business, The Art of Storytelling, 3-Step Storytelling Framework, Sketching the Story Blueprint, Profits by Region Analysis using Storyboard in Tableau, Capstone Project: Sales and Profit by Segment using Storyboards in Tableau, Getting started with SQL, Types of Databases, How data is Stored in Relational Databases, How data is stored in NoSQL databases, Exercise 1, Introduction, Architecture: Client and Server, MySQL Distributions, Local Installation on Mac, Local Installation on Linux, Local Installation on Windows, Licensing, Accessing a remote MySQL server, Graphical user interfaces, Exercise 2, SQL - Installation Guide, Introduction, What exactly is SQL?, History of SQL, Connecting to MySQL, Types of Commands - DDL (Creation/ Deletion/ Updating of Schema, Types of Commands - DML (Manipulating data in tables), Types of Commands - DCL (Managing Access control), Exploring databases, Creating tables, Inserting data in tables, SELECT Statement - Introduction, Datatypes in MySQL, NULL vs NOT NULL, Exercise 3, Introduction, Update command – Concept, Update command – Example, Delete command – Concept, Delete command – Example, Describe command – Concept, Describe command – Example, Alter command – Concept and Example, Exercise 4, Introduction, Importing data from CSV to MySQL, Exporting data from MySQL to CSV, Backing up databases, Restoring databases, Exercise 5, Importing and Exporting Datasets - Troubleshooting Guide, Introduction, Counting Rows and Items, Aggregation Functions – SUM, AVG, STDDEV, Extreme Values Identification – MIN, MAX, Slicing data, Limiting data, Sorting data, Filtering Patterns, Groupings, Rolling up data and Filtering in Groups, Exercise 6, Introduction, Data Eyeballing, Data Dictionary, Questions we need answers of, Analyzing data and creating table structure, Loading data to our MySQL table, Data Analysis – Simple Queries, Data Analysis – Advanced Queries, FIFA19 Players dataset (cleaned) for this Project, Introduction, The need for joins, Different type of joins, The Left Join - Concept, The Left Join – Practical Example, The Inner Join, The Cross Join, The Right Join, The Self Join, Exercise, Introduction, Introduction to Indexing, How indexing works (basics), Relationships, Types of Relationships, Table Constraints – PRIMARY KEY, FOREIGN KEY, UNIQUENESS and AUTO INCREMENT, Exercise, String functions - CONCAT, String functions – Case Conversion, String functions – Trimming Strings, String functions – Extracting Substrings, Date/ Time functions – Current date and time, Date/ Time functions – Extracting date and time from field, Date/ Time functions – Formatting date and time as Strings, Numeric functions, SQL CheatSheet, Exercise, Introduction, Setting up a virtual environment, Installing the required packages, Connecting to MySQL, Connecting to database table and pulling data, Querying the database- INSERT, Querying the database- DELETE, Querying the database- SEARCH, Querying the database- INDEXING, Notes and Resources, Subscribe to Data Science Newsletter and Podcast;March 2024: Data Exploration: Overview of Statistics, Important applications of Statistics, What is Descriptive Statistics?, Introduction to Design experiments, Introduction to Design experiments-Video, Exercise, Visualizing Data, Visualizing Data, Central tendency, Exercise, Variability, Unimodal Distribution of Data, Bimodal Distribution of Data, Normal distribution – Part 1, Normal distribution – Part 2, Z-Score, Introduction to Probability- An Overview, Principal Of Counting, Exercise, Permutation, Exercise, Combination, Exercise, Conditional Probability – Part 1, Conditional Probability – Part 2, Exercise, Binomial Distribution, Random variable, Expectation and variance, Exercise, Cheatsheet for Probability, Statistics: Inferential-Hypothesis Testing, T-test, One Way ANOVA, Chi-square, Cheatsheet on Statistics, Exploratory Data Analysis (EDA)- Data Exploration, Cheatsheet on EDA, Project-1 | Loan Prediction, Project-2 | Big Mart Sales, Linear Algebra, Free Course;April 2024: Basics of Machine Learning and art of storytelling: Overview of Machine Learning, Understanding Data Science Pipeline, Get Familiarised with Command Line (Linux)- Guide, Linear Regression, Linear Regression-Video, Exercise, Logistic Regression- Part 1, Logistic Regression – Part 2, Exercise, Decision Tree Algorithm, Exercise, Naive Bayes, Support Vector Machine, Regression Project - Big Mart Sales, Classification Project - Loan Prediction, Introduction to Structured Thinking, Commonly Asked Puzzles in Interviews, How to solve Guesstimates?, Excercise: Strategic Thinking, Structured Thinking and Communication Course;May 2024: Advanced Machine Learning: Ensemble Learning Basics, Ensemble Learning Basics-Video, Bagging, Boosting, Random Forest - Simplified, Random Forest - Detailed with implementation, Exercise, Boosting - Detailed with implementation, XGBoost, LightGBM, CatBoost, Exercise, Advanced Ensemble Technique - Blending, Advanced Ensemble Learning - Stacking, Cheatsheet for Machine Learning, Image data, Text data, Audio data, Audio data-Video, Projects, Participating in Competitions, Introduction to validation, Different Types of Validation Techniques, K-fold Cross Validation - Implementation, Summary - Validation Techniques, Exercise, Different methods for finding best hyperparameters of an algorithm, Hyperparameter tuning for Random Forest, Hyperparameter tuning for GBM, Hyperparameter tuning for XGBoost, Hyperparameter tuning for LightGBM, Bayesian Hyperparameter Optimization, Feature Engineering, Profile Building, Building your Resume, Up Level your Data Science Resume Course, Ace Data Science Interview Course;June 2024: Other Machine Learning Concepts: Basics of Matrix Algebra, Matrix Calculus, Dimensionality Reduction - Overview, Principal Component Analysis (PCA), Singular Value Decomposition (SVD), Singular Value Decomposition (SVD)-Text, Unsupervised Learning-K Means and Hierarchical Clustering, Clustering - Project, Learn Github, Introduction to Recommendation Systems, Introduction to Recommendation Systems - Video, Project: Recommendation System, Implementation in Python, Introduction to Time Series Forecasting, Handling a Non-Stationary Time Series in Python, Time Series Modeling using ARIMA, Time Series Modeling using Prophet Library, Time Series Project, Project - Black Friday;July 2024: Introduction to Deep Learning and Computer Vision: Setting up the System for Deep Learning, Introduction to Deep Learning, Build your first Neural Network in Numpy, Why are GPUs necessary for Deep Learning?, The Evolution and Core Concepts of Deep Learning & Neural Networks, An Introduction to Implementing Neural Networks using TensorFlow, Introduction to Keras, Optimizing Neural Networks using Keras (with Image recognition case study), Understanding Convolutional Neural Networks (CNNs), Build Image Classification Model using Keras, Exercise, Transfer Learning for Computer Vision, Computer Vision Project 1 : Identify the Apparels, Computer Vision Project 2: Scene Classification, Computer Vision using Deep Learning Course, Computer Vision Course (Sponsored), Cheatsheet for Keras, Write for Analytics Vidhya's Medium Publication;August 2024: Basics of Natural Language Processing: Recurrent Neural Network, Long short Term Memory Networks (LSTM), Gated Recurrent Unit (GRU), Useful resources-GRU, Text Preprocessing, Text Cleaning, Text Classification, Natural Language Processing (NLP) Using Python Course;September 2024: Model Deployment: How to Deploy Machine Learning Models using Flask, Tutorial to deploy Machine Learning models in Production as APIs, Deploying machine learning models using Streamlit – An introductory guide to Model Deployment, An Ode to Model Deployment using Streamlit – Open Sourcing “Typing Tutor for Programmers”;October 2024: Practice and Projects: Building a Portfolio with Projects"
Exploring Stability.AI - Free Course,"This course will give you a practical understanding of Stability.AI tools. By the end of the course, you will be able to deploy and customize SD WebUI, and use the Automatic1111 WebUI on RunPod GPU environments. You'll learn to install, set up, generate, and fine-tune SD WebUI settings, equipping you with the skills to harness Stability.AI's full potential for your projects.This course will give you a practical understanding of Stability.AI tools. By the end of the course, you will be able to deploy and customize SD WebUI, and use the Automatic1111 WebUI on RunPod GPU environments. You'll learn to install, set up, generate, and fine-tune SD WebUI settings, equipping you with the skills to harness Stability.AI's full potential for your projects.Who Should Enroll:Professionals:Individuals aiming to enhance their skill set and apply Stability.AI tools/Stable Diffusion in various fields.Professionals:Individuals aiming to enhance their skill set and apply Stability.AI tools/Stable Diffusion in various fields.Aspiring Students:Those beginning their journey to mastering Generative AI tool deployment and customization, looking to make an impact in the evolving world of Generative AIAspiring Students:Those beginning their journey to mastering Generative AI tool deployment and customization, looking to make an impact in the evolving world of Generative AI","Mastering stability.ai and its tools: Introduction to Stability, How to use Stability.AI tools, Review of Deployment Options for SD WebUI, Automatic1111 WebUI on RunPod GPU environment, SD WebUI Hands-On - Installation and Setup, SD WebUI Hands-On - Generation and Settings, Quiz"
Building Smarter LLMs with Mamba and State Space Model,"Unlock the Power of State Space Models (SSM) like Mamba with our comprehensive course designed for AI professionals, data scientists, and NLP enthusiasts. Master the art of integrating SSM with deep learning, unravel the complexities of models like Mamba, and elevate your understanding of Generative AI's newest and most innovative models. This course is designed to equip you with the skills needed to understand these cutting-edge AI models and how they work, making you proficient in the latest AI techniques and architectures.Unlock the Power of State Space Models (SSM) like Mamba with our comprehensive course designed for AI professionals, data scientists, and NLP enthusiasts. Master the art of integrating SSM with deep learning, unravel the complexities of models like Mamba, and elevate your understanding of Generative AI's newest and most innovative models. This course is designed to equip you with the skills needed to understand these cutting-edge AI models and how they work, making you proficient in the latest AI techniques and architectures.","Course Overview: Course Overview;An Alternative to Transformers: Are RNNs a Solution, The Problem with Transformers;Understanding State Space Models: What is a State Space Model?, The Discrete Representation, The Recurrent Representation, The Convolution Representation, The Three Representations, The Importance of the A Matrix;Mamba - A Selective State Space Model: What Problem does it attempt to Solve?, Selectively Retaining Information, Speeding Up Computations, Exploring the Mamba Block, Jamba - Mixing Mamba with Transformers"
Getting Started with Neural Networks,"What is a neural network? How does it work? What does a neural network do? Learn neural networks for free in this course and get your neural network questions answered, including applications of neural networks in deep learning.Do you want to acquire a super power? How about learning neural networks? Neural networks are at the heart of the deep learning revolution that’s happening around us right now.Neural networks are the present and the future. The different neural network architectures like convolutional neural networks (CNN), recurrent neural networks (RNN), and others have altered the deep learning landscape.From classifying images and translating languages to building a self-driving car, neural networks are powering the world around us. Thanks to the idea of neural networks like CNN and RNN, deep learning has penetrated into multiple and diverse industries, and it continues to break new ground on an almost weekly basis!Where should you begin learning? Neural networks can appear to be complex to master. In a lot of ways, they are. We have seen quite a number of aspiring data scientists and deep learning enthusiasts give up before they even touched a neural network!But they’ve gone about it the wrong way. There are a lot of myths about neural networks that force people to quit:Mastering all of these would take you years!So, how else can you learn neural networks?That is EXACTLY what this free course by Analytics Vidhya will teach you.","Introduction to Deep Learning: What is Deep Learning?, Difference b/w Deep Learning and Machine Learning, Why Deep Learning is so popular?, AI&ML Blackbelt Plus Program (Sponsored);Getting ready for the course: Hardware for Computations in Deep Learning, Setting up your system, Introduction to Google Colab, Understanding Google Colab Interface, Pre-requisites for Deep Learning;Introduction to Neural Network: Perceptron, Quiz - Perceptron, Weights in Perceptron, Quiz - Weights in Perceptron, Multi Layer Perceptron, Quiz - Multi Layer Perceptron, Forward and Backward Prop Intuition, Quiz - Forward and Backward Prop Intuition, Gradient Descent Algorithm, Quiz - Gradient Descent Algorithm;Activation Functions: Why do we need activation functions?, Quiz - Why do need activation functions, Linear Activation Function, Quiz - Linear Activation Function, Sigmoid and tanh, Quiz - Sigmoid and tanh, Softmax, Quiz - Softmax;Loss Function: Introduction to loss function, Quiz - Introduction to Loss Function, Binary and Categorical Cross entropy / log loss, Quiz - Binary and Categorical cross entropy / log loss;NN on structured Data: Understanding Problem Statement: Loan Prediction, Data Preprocessing: Loan Prediction, Quiz - Data Preprocessing: Loan Prediction, Steps to solve Loan Prediction Challenge, Loading loan prediction dataset, Defining the Model Architecture for loan prediction problem, Training and Evaluating model on Loan Prediction Challenge, Quiz - Training and Evaluating model on Loan Prediction Challenge;Assignment: Big Mart Sales Prediction: Assignment: Big Mart Sales Prediction;Real World Use cases of Deep Learning: Object Detection, segmentation, image generation, Quiz - Object Detection, Segmentation, image generation, Sequential Modeling, Quiz - Sequential Modeling;Where to go from here?: Where to go from here?"
Nano Course: Building Large Language Models for Code,"In this Free Nano GenAI Course onBuilding Large Language Models for Code, you will-Learn how to train LLMs for Code from Scratch covering Training Data Curation, Data Preparation, Model Architecture, Training, and Evaluation Frameworks.Explore each step in-depth, delving into the algorithms and techniques used to create StarCoder, a 15B code generation model trained on 80+ programming languages.Understand and learn the best practices to train your own StarCoder on the data","Building Large Language Models for Code: Introduction, Agenda, BigCode Community, Training LLMs for Code from Scratch: Training Data Curation, Training Data Formatting and Preprocessing, Model Architecture, BigCode Ecosystem, Training Frameworks, Model Evaluation, Tools and Descendants of StarCoder"
Generative AI - A Way of Life - Free Course,"This course is a transformative journey tailored for beginners and delves into AI-powered text and image generation using leading tools like ChatGPT, Microsoft Copilot, and DALL·E3. Learn practical applications across industries, ethical considerations, and best practices. Whether you're a content creator, business innovator, or AI enthusiast, gain the expertise to harness Generative AI's full potential and drive innovation in your field.This course is perfect for beginners with no technical background, professionals looking to enhance their AI skills, students eager to explore AI, and content creators seeking to leverage AI tools. If you're curious about AI's potential and want to stay ahead in your field, this course is for you.Getting Started with Large Language ModelsBuilding LLM Applications Using Prompt EngineeringBuilding your First RAG System using LlamaIndexWhat is Generative AI?Generative AI refers to algorithms that can create new data, such as images, text, and music, by learning patterns from existing data.Do I need to know programming to learn Generative AI?Having a basic understanding of Python programming is not compulsory, but if you are interested in learning Python there's also a free course available on our platform.What are the real-world applications of Generative AI?From AI art to content creation tools and personalized marketing campaigns, Generative AI is revolutionizing industries worldwide.How does Generative AI differ from traditional AI?Traditional AI focuses on classification and prediction, while Generative AI creates new content or data based on learned patterns.Is this course suitable for beginners?Absolutely! This course is designed for all levels, including those new to machine learning and deep learning.","Introduction to Generative AI: Fundamentals of Generative AI, What is Generative AI?, How does Generative AI work?, Exploring the Potential of Generative AI, GenAI Pinnacle Program, Hands On: Let’s get generating!;Text Generation Using Generative AI: An Overview of Text Generation, What is ChatGPT?, Working with ChatGPT, Working with ChatGPT Plus, Build a Custom GPT, Working with Microsoft Copilot, Working with Google Gemini, Gen AI Pinnacle Ad, Learning the Art of Prompting, Creating a Chatbot, Ethics and Best Practices;Image Generation Using Generative AI: Introduction to Image Generation, Exploring the Potential of Image Generation, Working with free image generation tools, Working with Clipdrop, Working with Bing Image Creator, Working with Firefly, Working with Paid Image Generative Tools, Working with paid image generative tools DreamStudio, Working with DALLE-2, Working with Midjourney, Gen AI Pinnacle Ad, Prompting your Way to Art, Accomplishing Tasks with Image Generation, E for Ethics and Efficiency"
