title,description,curriculum
Building LLM Applications using Prompt Engineering - Free Course,"This course will provide you with a hands-on understanding of building LLM applications and mastering prompt engineering techniques. By the end of the course, you will be proficient in implementing and fine-tuning these techniques to enhance generative AI model performance. You'll learn to apply various prompting methods and build chatbots on enterprise data, equipping you with the skills to improve conversational AI systems in real-world projects.Who Should Enroll:Professionals:Individuals looking to deepen their knowledge and apply advanced LLM and prompt engineering techniques to solve complex problems across various domains.Professionals:Individuals looking to deepen their knowledge and apply advanced LLM and prompt engineering techniques to solve complex problems across various domains.Aspiring Students:Individuals looking to deepen their knowledge and apply advanced LLM and prompt engineering techniques to solve complex problems across various domains.Aspiring Students:Individuals looking to deepen their knowledge and apply advanced LLM and prompt engineering techniques to solve complex problems across various domains.","How to build diffferent LLM AppIications?: Introduction to Building Different LLM applications, Prompt Engineering, Retrieval Augmented Generation, Finetuning LLMs, Training LLMs from Scratch, Quiz;Getting Started with Prompt Engineering: Course handouts, Introduction to Prompt Engineering, Set up your machine for Prompt Engineering, Prompt Engineering with ChatGPT API, Enabling Conversation with ChatGPT API, Quiz;Understanding Different Prompt Engineering Techniques: Introduction to Understanding Different Prompt Engineering Techniques, Few Shot Prompting, One Shot Prompting, Zero Shot Prompting, Quiz, Assignment"
Coding a ChatGPT-style Language Model from Scratch in PyTorch,"Master the art of building a ChatGPT-style language model from scratch with PyTorch.In this course, you'll explore essential NLP concepts, implement transformers, and create a decoder-only architecture step-by-step. Guided by expert tutorials, gain practical skills to develop advanced AI models tailored for real-world applications.","Coding a ChatGPT: Introduction, Importing, Creating Inputs & Lables, Position Encoding, Masked Self-Attention, Putting Pieces Together, Creating Decoder Only Transformer"
Getting started with Decision Trees,"A Decision Tree is a flowchart like structure, where each node represents a decision, each branch represents an outcome of the decision, and each terminal node provides a prediction / label.This course addressespractical challengesfaced in buildingDecision Tree models. You will achieve these outcomes by end of this course:","Getting Started with Decision Tree: Introduction to Decision Tree, Purity in Decision Trees, Quiz: Purity in Decision Trees, Terminologies Related to Decision Trees, Quiz: Introduction to Decision Trees, Terminologies Related to Decision Trees, How to Select the Best Split Point in Decision Trees, Quiz: How to Select the Best Split Point in Decision Trees, Chi-Square, Quiz: Chi-Square, Information Gain, Quiz: Information Gain, Reduction in Variance, Quiz: Reduction in Variance, Optimizing Performance of Decision Trees, Quiz: Optimizing Performance of Decision Trees, Decision Tree Implementation, Dataset: Decision Tree Implementation, Where to go from here?, AI&ML Blackbelt Plus Program (Sponsored)"
Introduction to Business Analytics,"Getting Started with Business AnalyticsWhat is Business Analytics? Why has it become so popular recently? What are some of the popular applications of Business Analytics? And more importantly, how can you get started with learning Business Analytics from scratch?With growth in digitisation, Business Analytics is ubiquitous right now. Organizations are splurging to integrate data science solutions in their daily processes. This is where they need Business Analysts.Why pursue Business Analytics:","What is Business Analytics?: What is Business Analytics?, Quiz: What is Business Analytics, You just joined an exicting startup!, Quiz - Map the Job families, Data Scientist vs. Data Engineer vs. Business Analyst, Quiz - Map the responsibilities, Sample problems and projects - Business Analytics vs. Data Science, Quiz: Sample problems and Projects - Business Analysts vs. Data Scientits, A few more things - Business Analytics vs. Data Science, Career in Business Analytics, Knowing Each other, AI&ML Blackbelt Plus Program (Sponsored);Spectrum of Business Analytics: Terms related to Business Analytics, Management Information Systems (MIS), Detective Analysis, Business Intelligence, Predictive Modeling, Artificial Intelligence and Machine Learning, What kind of problems do Business Analysts work on?;Skills Required for Business Analytics and Roadmap of Business Analytics Program: Skills Required in Business Analytics Roles, Download the Roadmap for Certified Business Analytics Program (CBAP), Bonus Section - Logistics of Certified Business Analytics Program from Analytics Vidhya;Case study: Ezine Publishing: Overview - Case study - Ezine Publishing, Understanding Business, Quiz: Identify Focus Categories, Quiz: Getting Granular with traffic data, Quiz - Identify effective channel, Quiz - Maximize Revenue, Quiz - Target Customers, Quiz: Traffic Distribution, Quiz - Advertisements, Where to go from here?;Your Feedback Matters!: Please share your valuable experince"
Getting Started with Git and GitHub for Data Science Professionals,"Ever heard of version control? It is one of the most important concepts in a data scientist’s daily role - and yet most newcomers and beginners haven’t even come across it! This is a fallacy you must overcome as soon as possible.You need to understand how to navigate through Git and GitHub if you want to make it as a data science professional. While a lot of folks know about these tools (having used them for cloning open source code from Google Research and other top data science organizations), they never really understand their real purpose.The beauty of version control will be akin to a revelation. The way you can create a remote project and have all your team members work on different features parallelly yet independently but still have a stable running code at the end of the day - priceless! A lot of the problem we face in data science while working remotely and independently will be erased with a quick understanding of Git and GitHub.Yes, this course really is that important!","Getting Familiar with Git and Github: What is Git?, What is Github?, AI&ML Blackbelt Plus Program (Sponsored);Understand Git Terminology: What is a Repository?, Understand Cloning, Let's Commit!, Understanding Push, Understanding Pull;Get Started with Git: Install Git in your system, Let's Initialize Git!, Configure Git in your system, Committing files in Git, View Logs in Git;Going Remote - Get started with Github: Create Remote Repository, Add Git Remote to Your Repository, Push using Git, Cloning a GitHub Repository, Branching and Merging, Pull using Git;What's next?: Forking and contributing to the world"
A Comprehensive Learning Path for Deep Learning in 2023,"The most common question we get from beginners in the field of Deep Learning is - Where to begin? The journey to becoming a Deep Learning expert can be difficult if one does not have the right resources to follow. There are a million resources to refer and it is tough to decide where to start from.We are here to help you take your first steps into the world of Deep Learning. Here is a free learning path for people who want to become a Deep Learning expert in 2023. We have arranged the best resources in a logical manner along with exercises to make sure that you only need to follow one single source to become a data scientist.The course is ideal for beginners in the field of Deep Learning. Several features which make it exciting are:Beginner friendly courseThe course assumes no prerequisites and is meant for beginnersCurated list of resources to followAll the necessary topics are covered in the course, in an orderly manner with links to relevant resources and hackathons.This is a beginner friendly course and has no prerequisites.Support for A Comprehensive Learning Path for Deep Learning in 2023 course can be availed through any of the following channels:","January 2023: Getting Started, Overview of the Learning Path, Month-on-Month Plan, Introduction to Deep Learning, Applications of Deep Learning, Setting up your System, Descriptive Statistics and Probability, Python, Exercise : Python, AI&ML Blackbelt Plus Program (Sponsored);February 2023: Start engaging in data science / deep learning communities, Inferential Statistics, Exercise : Statistics, Partial Derivative, Linear Algebra - Part 1, Linear Regression, Logistic Regression, Exercise : Linear and Logistic Regression, Regularization Techniques (Ridge and Lasso), Project;March 2023: Start building your GitHub profile, Start building your GitHub profile, Linear Algebra - Part 2, Getting Started with Neural Networks, Understanding Forward Propagation, Understanding Back Propagation, Exercise : Understanding Neural Networks, Build your first Neural Network in Numpy, Frameworks for Deep Learning, Introduction to Keras, Build your first Neural Network in Keras, Project;April 2023: Start Participating in Competitions, Handling / Pre-processing Images, Exercise, Hyperparameter Tuning, Regularization Techniques, Optimization Algorithms, Exercise, Project;May 2023: Understanding Convolutional Neural Networks (CNNs), Exercise : CNNs, Hyperparameter Tuning, Transfer Learning, Data Augmentation, Project;June 2023: Build your resume and apply for Internships, Visualizing Convolutional Neural Networks, Project 3 on CV, Project 4 on CV;July 2023: Start writing articles, Handling / Pre-processing Text Data, Exercise, Recurrent Neural Networks (RNNs), RNNs - Video, LSTM, GRUs, Transfer Learning for NLP, Project 1 on NLP;August 2023: Word Embeddings, Exercise, Project 2 on NLP;September 2023: Attention Models, Attention Models - Text, Project on Attention Models;October 2023: Unsupervised Deep Learning, Project on Unsupervised Deep Learning;November 2023: GANs : Video, GANs, Project on GANs;December 2023: Apply for Jobs and Internships, Way Forward"
Understanding Linear Regression - Free Course,"This free course will help you understand the fundamentals of linear regression in a straightforward manner. By the end of this course, you will be able to build predictive models using linear regression techniques. With a carefully curated list of resources and exercises, this course serves as your comprehensive guide to mastering linear regression.","Linear Regression: Introduction to the Problem Statement, Resources for this Course, Introduction to Linear Regression, Significance of Slope and Intercept in the linear regression, How Model Decides The Best-Fit Line, Let’s Build a Simple Linear Regression Model, Model Understanding Using Descriptive Approach, Model Understanding Using Descriptive Approach - II, Model Building Using Predictive Approach, Quiz: Linear regression"
Reimagining GenAI: Common Mistakes and Best Practices for Success,"Generative AI is transforming industries, but implementation challenges often hinder its success. This course, led by experienced GenAI expert Shabazz Mohammed, dives deep into the pitfalls of adopting generative AI and provides actionable best practices to overcome them.Learn from real-world scenarios, understand why hi-fi demos fail in production, and gain insights into scalable, ethical, and ROI-driven AI adoption.","Common Mistake and Best practices: Introduction, State of GenAI in 2024, Common Mistakes, Best Practices for Success, Demo- GenAI Chatbot Alignment, Case Study- Top US Bank Co-pilot on CLO Documents"
Machine Learning Summer Training,"This is the second step of theMachine Learning Summer Training, want to know moreclick here.This is the second step of theMachine Learning Summer Training, want to know moreclick here.If you are a college student and looking for summer training, then you are at the right place where Analytics Vidhya is providing its virtual training along with the mega hackathon for students all over the world to compete, win grand rewards and internship opportunities.Machine Learning Summer Training is an online program to build and enhance your programming and machine learning skills, led by the best industry experts and data science professionals. After completing this training you will be provided with a blockchain enabled certificate by Analytics Vidhya with lifetime validity.This is the perfect starting point to ignite your fledging machine learning career and take a HUGE step towards your dream data scientist role.If you haven't enrolled in the program already, Don't wait!Machine Learning is the science of teaching machines how to learn by themselves. Machine Learning is re-shaping and revolutionizing the world and disrupting industries and job functions globally.Machine learning is so extensive that you probably use it numerous times a day without even knowing it. From unlocking your mobile phones using your face to giving your attendance using a biometric machine, machine learning is being used in almost every stage.In this age of machine learning, every aspiring data scientist is expected to upskill themselves in machine learning techniques & tools and apply them in real-world business problems.Machine Learning problems can be divided into 3 broad classes:Machine Learning problems can be divided into 3 broad classes:Supervised Machine LearningSupervised Machine LearningUnsupervised Machine LearningUnsupervised Machine LearningReinforcement LearningReinforcement LearningHere is an illustration of these different machine learning problems:Here is an illustration of these different machine learning problems:When you have past data with outcomes (labels in machine learning terminology) and you want to predict the outcomes for the future – you would use Supervised Machine Learning algorithms. Supervised Machine Learning problems can again be divided into 2 kinds of problems:When you want to classify outcomes into different classes. For example – whether a customer would default on their loan or not is a classification problem which is of high interest to any BankWhen you are interested in answering how much – these problems would fall under the Regression umbrella. For example – what is the expected amount of default from a customer is a Regression problemThere are times when you don’t want to exactly predict an Outcome. You just want to perform a segmentation or clustering. For example – a bank would want to have a segmentation of its customers to understand their behavior. This is an Unsupervised Machine Learning problem as we are not predicting any outcomes here.It is said to be the hope of true artificial intelligence. And it is rightly said so because the potential that Reinforcement Learning possesses is immense. It is a slightly complex topic as compared to traditional machine learning but an equally crucial one for the future.This course requires no prior knowledge about Data Science or any tool.In this machine learning summer training, we will be covering the following topics:","Overview of the Course: AI&ML Blackbelt Plus Program (Sponsored);Introduction to Data Science and Machine Learning: Overview of Machine Learning / Data Science, Common Terminology used in Data Science, Applications of Data Science;Setting up your system: Installation steps for Windows, Installation steps for Linux, Installation steps for Mac;Introduction to Python: Introduction to Python, Introduction to Jupyter Notebook, Download Python Module Handouts;Variables and Data Types: Introduction to Variables, Implementing Variables in Python;Operators: Introduction to Operators, Implementing Operators in Python, Quiz: Operators;Conditional Statements: Introduction to Conditional Statements, Implementing Conditional Statements in Python, Quiz: Conditional Statements;Looping Constructs: Introduction to Looping Constructs, Implementing Loops in Python, Quiz: Loops in Python, Break, Continue and Pass Statements, Quiz: Break, Continue and Pass Statement;Data Structures: Introduction to Data Structures, List and Tuple, Implementing List in Pyhton, Quiz: Lists, List - Project in Python, Implementing Tuple in Python, Quiz: Tuple, Introduction to Sets, Implementing Sets in Python, Quiz: Sets, Introduction to Dictionary, Implementing Dictionary in Python, Quiz: Dictionary;String Manipulation: Introduction to String Manipulation, Quiz: String Manipulation;Functions: Introduction to Functions, Implementing Functions in Python, Quiz: Functions in Python, Lambda Expression, Quiz: Lambda Expressions, Recursion, Implementing Recursion in Python, Quiz: Recursion;Modules, Packages and Standard Libraries: Introduction to Modules, Modules: Intuition, Introduction to Packages, Standard Libraries in Python, User Defined Libraries in Python, Quiz:  Modules, Packages and Standard Libraries;Handling Text Files in Python: Handling Text Files in Python, Quiz: Handling Text Files;Introduction to Python Libraries for Data Science: Important Libraries for Data Science, Quiz: Important Libraries for Data Science;Python Libraries for Data Science: Basics of Numpy in Python, Basics of Scipy in Python, Quiz: Numpy and Scipy, Basics of Pandas in Python, Quiz: Pandas, Basics of Matplotlib in Python, Basics of Scikit-Learn in Python, Basics of Statsmodels in Python;Reading Data Files in Python: Reading Data in Python, Reading CSV files in Python, Reading Big CSV Files in Python, Quiz: Reading CSV files in Python, Reading Excel & Spreadsheet files in Python, Quiz: Reading Excel & Spreadsheet files in Python, Reading JSON files in Python, Quiz: Reading JSON files in Python;Preprocessing, Subsetting and Modifying Pandas Dataframes: Subsetting and Modifying Data in Python, Overview of Subsetting in Pandas I, Overview of Subsetting in Pandas II, Subsetting based on Position, Subsetting based on Label, Subsetting based on Value, Quiz: Subsetting Dataframes, Modifying data in Pandas, Quiz: Modifying Dataframes;Sorting and Aggregating Data in Pandas: Preprocessing, Sorting and Aggregating Data, Sorting the Dataframe, Quiz:  Sorting Dataframes, Concatenating Dataframes in Pandas, Concept of SQL-Like Joins in Pandas, Implementing SQL-Like Joins in Pandas, Quiz: Joins in Pandas, Aggregating and Summarizing Dataframes, Preprocessing Timeseries Data, Quiz: Preprocessing Timeseries Data;Visualizing Patterns and Trends in Data: Visualizing Trends & Pattern in Data, Basics of Matplotlib, Data Visualization with Matplotlib, Quiz: Matplotlib, Basics of Seaborn, Data Visualization with Seaborn, Quiz: Seaborn;Machine Learning Lifecycle: 6 Steps of Machine Learning Lifecycle, Introduction to Predictive Modeling;Problem statement and Hypothesis Generation: Defining the Problem statement, Introduction to Hypothesis Generation, Performing Hypothesis generation, Quiz - Performing Hypothesis generation, List of hypothesis, Data Collection/Extraction, Quiz - Data Collection/Extraction;Importance of Stats and EDA: Introduction to Exploratory Data Analysis & Data Insights, Quiz -  Introduction to Exploratory Data Analysis & Data Insights, Role of Statistics in EDA, Descriptive Statistics, Inferential Statistics, Quiz - Descriptive and Inferential Statistics;Build Your First Predictive Model: Quiz: Build a Benchmark Model - Regression, Benchmark Model: Regression Implementation, Quiz: Benchmark Model - Regression Implementation, Build a Benchmark Model: Classification, Quiz: Build a Benchmark Model - Classification, Benchmark Model: Classification Implementation, Quiz: Benchmark - Classification Implementation;Evaluation Metrics: Introduction to Evaluation Metrics, Quiz: Introduction to Evaluation Metrics, Confusion Matrix, Quiz: Confusion Matrix, Accuracy, Quiz: Accuracy, Alternatives of Accuracy, Quiz: Alternatives of Accuracy, Precision and Recall, Quiz: Precision and Recall, Thresholding, Quiz: Thresholding, AUC-ROC, Quiz: AUC-ROC, Log loss, Quiz: Log loss, Evaluation Metrics for Regression, Quiz: Evaluation Metrics for Regression, R2 and Adjusted R2, Quiz: R2 and Adjusted R2;Preprocessing Data: Dealing with Missing Values in the Data, Quiz: Dealing with missing values in the data, Replacing Missing Values, Quiz: Replacing Missing values, Imputing Missing Values in data, Quiz: Imputing Missing values in data, Working with Categorical Variables, Quiz: Working with categorical data, Working with Outliers, Quiz: Working with outliers, Preprocessing Data for Model Building;Build Your First ML Model: k-NN: Building a kNN model, Quiz: Building a kNN model, Determining right value of k, Quiz: Determining right value of k, How to calculate the distance, Quiz: How to calculate the distance, Issue with distance based algorithms, Quiz: Issue with distance based algorithms, Introduction to sklearn, Implementing k-Nearest Neighbours algorithm, Quiz: Implementing k-Nearest Neighbours algorithm;Selecting the Right Model: Introduction to Overfitting and Underfitting Models, Quiz: Introduction to Overfitting and Underfitting Models, Visualizing overfitting and underfitting using knn, Quiz: Visualizing overfitting and underfitting using knn, Selecting the Right Model, What is Validation?, Quiz: What is Validation, Understanding Hold-Out Validation, Quiz: Understanding Hold-Out Validation, Implementing Hold-Out Validation, Quiz: Implementing Hold-Out Validation, Understanding k-fold Cross Validation, Implementing k-fold Cross Validation, Quiz: Understanding k-fold Cross Validation, Quiz: Implementing k-fold Cross Validation, Bias Variance Tradeoff, Quiz: Bias Variance Tradeoff;Linear Models: Introduction to Linear Models, Quiz: Introduction to linear model, Understanding Cost function, Quiz: Understanding Cost function, Understanding Gradient descent (Intuition), Maths behind gradient descent, Convexity of cost function, Quiz: Convexity of Cost function, Quiz: Gradient Descent, Assumptions of Linear Regression, Quiz: Assumptions of linear model, Implementing Linear Regression, Generalized Linear Models, Quiz: Generalized Linear Models, Introduction to Logistic Regression, Quiz: Introduction to logistic regression, Quiz: Logistic Regression, Odds Ratio, Implementing Logistic Regression, Multiclass using Logistic Regression, Quiz: Multi-Class Logistic Regression, Challenges with Linear Regression, Quiz: Challenges with Linear regression, Introduction to Regularisation, Quiz: Introduction to Regularization, Implementing Regularisation, Coefficient estimate for ridge and lasso (Optional);Project: Customer Churn Prediction: Predicting whether a customer will churn or not;Decision Tree: Introduction to Decision Trees, Quiz: Introduction to Decision Trees, Purity in Decision Trees, Quiz: Purity in Decision Trees, Terminologies Related to Decision Trees, Quiz: Terminologies Related to Decision Trees, How to Select the Best Split Point in Decision Trees, Quiz: How to Select the Best Split Point in Decision Trees, Chi-Square, Quiz: Chi-Square, Information Gain, Quiz: Information Gain, Reduction in Variance, Quiz: Reduction in Variance, Optimizing Performance of Decision Trees, Quiz: Optimizing Performance of Decision Trees, Decision Tree Implementation;Feature Engineering: Introduction to Feature Engineering, Quiz: Introduction to feature engineering, Exercise on Feature Engineering, Overview of the module, Feature Transformation, Quiz: Feature Transformation, Feature Scaling, Quiz: Feature Scaling, Feature Encoding, Quiz: Feature Encoding, Combining Sparse classes, Quiz: Combining Sparse classes, Feature Generation: Binning, Quiz: Feature Generation- Binning, Feature Interaction, Quiz: Feature Interaction, Generating Features: Missing Values, Frequency Encoding, Quiz: Frequency Encoding, Feature Engineering: Date Time Features, Implementing DateTime Features, Quiz: Implementing DateTime Features, Automated Feature Engineering : Feature Tools, Implementing Feature tools, Quiz: Implementing Feature Tools;Project: NYC Taxi Trip Duration prediction: Exploring the NYC dataset, Predicting the NYC taxi trip duration, Predicting the NYC taxi trip duration;Feedback: Share Your Feedback about the course., Would  you recommend this course to your Friends."
Building a Text Classification Model with Natural Language Processing - Free Course,"Gain practical insights into Natural Language Processing (NLP) with our comprehensive course. Learn to build NLP models using PyTorch, delve into classification models, and apply techniques like bag-of-words, count vectorizer and so on. Perfect for professionals seeking to enhance their skills and aspiring students entering the tech industry.Who Should Enroll:Who Should Enroll:Professionals:Expand your skill set with NLP for real-world applications in diverse industries.Aspiring Students:Master text data analysis and kickstart your career in AI and NLP.","Introduction to NLP: What is NLP, Common tasks in a NLP Project, NLP Libraries, Resources for the Course, Methods of Text Preprocessing - Part 1, Methods of Text Preprocessing - Part 2, Methods of Text Preprocessing - Part 3, Quiz;Building a basic classification model: Introduction to dataset and problem statement, Creating a Basic Review Classification Model, Understanding TF-IDF and its implementations, Understanding N-grams, Advanced Preprocessing Techniques, Building an basic ANN model, Limitations of ANN, Quiz"
