title,description,curriculum
Ace Data Science Interviews,"Are you trying to get into data science roles but getting rejected by employers? Are you scared of getting into data science interviews? Or don't know what to expect in data science interviews? This is just the course you need.While you might know the tools and techniques in data science, clearing a data science interview might still prove very difficult. You need to show your problem solving skills and technical prowess in these data science interviews.This course has been created based on hundreds of interviews we have taken, companies we have helped in data science interviews and several data science experts in the industry.Key learnings and takeaways from ""Ace Data Science Interviews"" course:Downloadable Resources:","Overview - Ace Data Science Interviews: ;Overview - The 7 step Data Science Interviews process: Infographic - The 7 Step Framework for Data Science Interviews;Step 1 - Understanding Roles, skills, Interviews Framework: Overview of Module 3, Overview of Different Roles, Senior Roles in Data Science, Mid-Management Roles in Data Science, Individual Contributors in Data Science, Overview of Different Types of Interviews, Technical Interviews, Assignments, HR Assessment, Business Case Studies, Guesstimates, Puzzles, Different Interviews for Different Job Roles, Exercise : Identify Roles;Step 2 - Building Your Digital Presence: 4.1 Building your Digital Presence, Ace Data Science Interviews - GitHub Checklist, Ace Data Science Interviews - LinkedIn Checklist;Step 3 - Building Resume and Applying for Jobs: 1. Importance of Resume, 2. 6 Step Process for Crafting your Resume, 3. Examples of Stand out Resumes, 4. Live Resume Screening - Example 1, 5. Live Resume Screening - Example 2, 6. Live Resume Screening - Example 3, 7. Overview of the Various Paths to Apply, 8. Applying to Online Portals, 9. Networking Based Applications, 10. Work Based Applications;Step 4 - Telephonic Interviews: 1. Why Companies Ask for Telephonic Interviews, 2. Telephonic Interview Checklist - BEFORE the Interview, 3. Telephonic Interview Checklist - DURING the Interview, 4. Telephonic Interview Checklist - POST the Interview, 5. Additional Tips for Video Interviews, Common Questions Interviewers Ask, Questions you can Ask the Interviewer;Step 5 - Assignments: 1. Why Companies Hand Out Assignments, 2. Assignments for Different Roles, 3. Tips to Ace the Interview Round;Step 6 - In Person Interview(s): 1. Overview of the Different Data Science Interview Types, 2. Technical Interviews, 3. Puzzle-Based Interview Rounds, 4. Tips to Solve Puzzles, 5. Cracking In-Person Case Studies, 6. Live In-Person Case Study - Example 1, 7. Feedback on the Case Study (Example 1), 8. Live In-Person Case Study - Example 2, 9. Feedback of the Case Study (Example 2), 10. Guesstimates, 11. HR Round, The Ultimate Handbook of Data Science Interview Questions, Download: The Ultimate Handbook of Data Science Interviews Questions;Step 7 - Post Interview Follow ups: 1. Post-Interview Steps, 2. Understanding the Different Post-Interview Steps, Assignment: Share your learning and build your profile"
Certified Machine Learning Master's Program (MLMP),,
Pandas for Data Analysis in Python,"Pandas is one of the most popular Python libraries in data science. In fact, Pandas is among those elite libraries that draw instant recognition from programmers of all backgrounds, from developers to data scientists.According to a recent survey by StackOverflow, Pandas is the 4th most used library/framework in the world. That is quite an achievement!Pandas is the first library we import when we fire up our Jupyter notebooks (‘import pandas as pd’ is indelibly etched in our minds!). It is a super flexible tool that enables us to perform data analysis and data manipulation on Pandas dataframes in double-quick time.If you’ve asked any of these questions before or are looking to learn Pandas from scratch, you’ve come to the right place.The great thing about Pandas is the sheer number of tasks you can perform in Python. It is often called the Swiss Army Knife of data analysis! That should give you a good idea of what you can expect from this powerful library.Here’s a taste of what we’ll cover in this course:And we have even included an illustrated Pandas cheatsheet just for you!","Getting Started with Pandas: Introduction to the Course, Pandas Installation, AI&ML Blackbelt Plus Program (Sponsored);Dataset Description: Loan Prediction, Big Mart Sales;Read & Write Data using Pandas: Understanding File System & shell commands, Reading Excel & CSV files, Writing Data using Pandas, Quiz: Reading a csv file using Pandas;Pandas Dataframes: What are Pandas Dataframes & its operations?, Selecting Columns & Rows in Pandas (Indexing), Quiz: DataFrames and basic operations;Data Exploration using Pandas: Basic Descriptive Statistics using Pandas, Plotting using Pandas, Quiz: Data Exploration using Pandas;Data Manipulation using Pandas: Renaming Column using Pandas, Sorting Data in Pandas DataFrame, Binning using Pandas, Handling Missing Values, Apply Function in Pandas for Element wise Operations, Quiz: Pandas Apply Function;Aggregating data using Pandas: Types of Aggregations in Pandas, Aggregations using Pandas in action, Quiz: Aggregations in Pandas;Merging Data using Pandas: Merging Data in Pandas Dataframes, Quiz: Merging Data using Pandas;Pandas Cheatsheet: Pandas Cheatsheet"
Data Preprocessing on a Real-World Problem Statement - Free Course,"This course will help you get a practical understanding of Data Preprocessing. After this course, you can work on any data and prepare it for modelling. With a carefully curated list of resources, this course is your first step to becoming a Data Scientist. By the end of the course, you will have mastered techniques like EDA and Missing Value Treatment.This course will help you get a practical understanding of Data Preprocessing. After this course, you can work on any data and prepare it for modelling. With a carefully curated list of resources, this course is your first step to becoming a Data Scientist. By the end of the course, you will have mastered techniques like EDA and Missing Value Treatment.Who Should Enroll:Who Should Enroll:Professionals: Individuals looking to expand their skill set on data cleaning and preparation.Professionals: Individuals looking to expand their skill set on data cleaning and preparation.Aspiring Students: For those setting out on their journey to become a data scientist and making a mark in the tech world.Aspiring Students: For those setting out on their journey to become a data scientist and making a mark in the tech world.","Preparing the Dataset for Machine Learning Model: Resources to be used in this course, Introduction to Problem Statement, Reading Material - Understanding the Data, ML-workflow, Tasks to be Performed, Combining Product Attribute Data with POS Data, Combining all the tables in the Dataframe, Understanding the Combined Data, Treating Missing Values - Part 1, Treating Missing Values Part - 2, Outlier Detection and Treatment, Preparing the Dataset for Supervised and Unsupervised Models, Generative AI for Data Analysis"
Certified Computer Vision Master's Program,"We have designed this certified program for Computer Vision enthusiasts like you who are looking for a place to start. Computer Vision is currently among the hottest fields in the industry. The demand for computer vision experts is outstripping the supply! So you’ve picked the perfect time to get into this field. This comprehensive program powers you to become a computer vision expert. The beauty of this program is that it assumes no prior knowledge of concepts. We start from the ground up by learning the basics of Python, statistics, core machine learning algorithms & fundamentals of Deep Learning.Once your base is rock solid, jump over to the Computer Vision using Deep Learning course. It is designed to give you a taste of how the underlying techniques work in current State-of-the-Art Computer Vision systems, and walks you through remarkable Computer Vision applications in a hands-on manner so that you can create such solutions on your own.You can then combine your technical knowledge with the learning from the Ace Data Science Interviews course to land your dream job in data science & computer vision! The program consists of five comprehensive and rich courses curated exclusively by Analytics Vidhya.Download BrochureDownload Project Details",
Introduction to Python,"Do you want to enter the field of Data Science? Are you intimidated by the coding you would need to learn? Are you looking to learn Python to switch to a data science career?You have come to just the right place!You have come to just the right place!Most industry experts recommend starting your Data Science journey with PythonAcross biggest companies and startups, Python is the most used language for Data Science and Machine Learning ProjectsStackoverflow survey for 2019 had Python outrank Java in the list of most loved languagesPython is a very versatile language since it has a wide array of functionalities already available. The sheer range of functionalities might sound too exhaustive and complicated, you don’t need to be well-versed with them all.Most data scientists have a few go-to libraries for their daily tasks like:Python has rapidly become the go-to language in the data science space and is among the first things recruiters search for in a data scientist's skill set.It consistently ranks top in global data science surveys and its widespread popularity will only keep on increasing in the coming years.Over the years, with strong community support, this language has obtained a dedicated library for data analysis and predictive modelling.This python data science course will help you learn Python libraries like Pandas and use them efficiently for data science and data analysis. Are you ready to power up your career and learn the best data science language?This python data science course will help you learn Python libraries like Pandas and use them efficiently for data science and data analysis. Are you ready to power up your career and learn the best data science language?Data Science is an amalgamation of Statistics, Computer Science and specific domain knowledge.As more and more data gets generated across the world, we need to leverage it to make decisions and improve them.A data scientist performs operations on the data provided to analyze and interpret it.Many of the biggest and most popular companies use Python. Some of them are:Google, NASA, AmazonSocial networking sites like Instagram, Reddit, Quora, etcMedia streaming companies like Netflix and SpotifyRideshare companies like Uber and Lyft“Python has been an important part of Google since the beginning and remains so as the system grows and evolves. Today dozens of Google engineers use Python, and we are looking for more people with skills in this language.”“Python has been an important part of Google since the beginning and remains so as the system grows and evolves. Today dozens of Google engineers use Python, and we are looking for more people with skills in this language.”- Peter Norvig, Director of Research at Google Inc.- Peter Norvig, Director of Research at Google Inc.So get onboard the Data Science train by learning Python and upskill yourself with one of the Top Data Science Courses offered by Analytics Vidhya!So get onboard the Data Science train by learning Python and upskill yourself with one of the Top Data Science Courses offered by Analytics Vidhya!Do I need to learn coding to learn Python?If you are totally new to programming, no need to get intimidated by learning a whole new language.If you are totally new to programming, no need to get intimidated by learning a whole new language.Python is a very easy language to learn:Python is a very easy language to learn:It does not have a complicated syntax and understanding Python is very intuitive.You don’t need to be skilled in coding for getting started in Python.This course is for beginners we will start right from the foundations to performing data analysis tasks in Python.This course is for beginners we will start right from the foundations to performing data analysis tasks in Python.I am familiar with other Programming Languages like Java/C++. Will this course help me to migrate to Python?Do you know that Python is essentially a wrapper on C? That is what makes it fast and easy to understand!Do you know that Python is essentially a wrapper on C? That is what makes it fast and easy to understand!Though Python has recently become popular amongst Data Scientists, it was originally a general-purpose language.Python is still object-oriented and follows many of the paradigms that Java does.So if you are familiar with the concepts of programming, you can migrate to Python easily with this course.How much Python do I need to know to enter Data Science?Though Python has hundreds of libraries and many more functionalities, you don’t need to know all of them for learning Data ScienceRather than becoming an expert in the entire language, you would need to just be acquainted with the basic syntax of Python.We will also cover the most popular libraries used by Data Scientists and which you would be using too as a future Data Scientist!What if I don’t have Python installed on my system?One of the best things about Python is the wide variety of platform that support writing it.One of the best things about Python is the wide variety of platform that support writing it.We will provide easy to follow instructions to work with Python using Anaconda, an extremely popular package manager platform.  No matter what Operating System you are using, we have you covered with guides for all of them.We will provide easy to follow instructions to work with Python using Anaconda, an extremely popular package manager platform.  No matter what Operating System you are using, we have you covered with guides for all of them.What are the most popular open-source libraries that Python supports?pandas, numpy, scipy, matlplotlib, seaborn are used for Data Science and Data Analysisscikit-learn, tensorflow, keras are used for basic and advanced machine learninglibraries for deep learning like OpenCV(Computer Vision), NLTK(Natural Language Processing)Will I be able to apply what I have learnt here to machine learning and data science projects?The Python for Data Science course is designed to help you completely understand Python and start using it immediately for Data Science projects.With regular assignments, quizzes and hands-on projects, you will be full equipped with the essential data science skillsets.","Overview of the Course: Overview of the Course, AI&ML Blackbelt Plus Program (Sponsored);Introduction to Python: A brief introduction to Python, Introduction to Python Test, Installing Python, Become a BlackBelt in Data Science;Understanding Operators: Theory of Operators, Exercise, Understanding Operators in Python, Operators Test;Variables and Data Types: Understanding variables and data types, Variable Test, Variables and Data Types in Python, Exercise;Conditional Statements: Understanding Conditional Statements, Exercise, Implementing Conditional Statements in Python, Conditional Statements test;Looping Constructs: Understanding Looping Constructs, Exercise, Implementing Looping Constructs in Python, Looping Constructs test;Functions: Understanding Functions, Implementing Functions in Python, Functions test;Data Structure: A brief introduction to data structure, Data Structure test;Lists: Understanding the concept of Lists, Lists test, Implementing Lists in Python, Exercise;Dictionaries: Understanding the concept of Dictionaries, Exercise, Implementing Dictionaries in Python, Dictionaries test;Understanding Standard Libraries in Python: Understanding the concept of Standard Libraries, Libraries test;Reading a CSV File in Python: Reading a CSV File in Python - Introduction to Pandas, Reading a CSV file in Python: Implementation, Reading a csv file in Python test;Data Frames and basic operations with Data Frames: Understanding dataframes and basic operations, DataFrames and basic operations test, Reading dataframes and conduct basic operations in Python, Reading dataframes and conduct basic operations in Python Test;Indexing a Data Frame: Indexing a Dataframe, Indexing DataFrames test, Exercise;Data Manipulation and Visualization: Sorting Dataframes, Merging Dataframes, Quiz: Sorting and Merging dataframes, Apply function, Aggregating data, Quiz: Apply function and Aggregating data, Basics of Matplotlib, Data Visualization using Matplotlib, Quiz: Matplotlib, Basics of Seaborn, Data Visualization using Seaborn, Quiz: Seaborn;Regular Expressions: Understanding Regular Expressions, Quiz: Regular Expressions, Regular Expressions in  Python, Quiz: Regular Expressions in Python;Cheatsheet for Python: Cheatsheet for Python;Evaluate: Instructions, Quiz, Python Coding Challenge;Feedback: Poll;Where to go from here?: Where to go from here?"
Machine Learning Starter Program,We generate more than 2.5 quintillion bytes of data every day - and companies across the globe are hiring data scientists to make sense of this data.A data scientist’s job is one of the most sought-after in the 21st century. Companies are increasingly looking for professionals with a variety of skills in Machine Learning. And that's what we are here to give you via our Machine Learning Starter Program.This is the perfect starting point to ignite your fledgling machine learning career and take a HUGE step towards your dream data scientist role.Download Project Details,
